,text,text_sent
0,"While you patiently wait for the next BioSchock game, there's some new, unexpected Bioshock content available. Wim Buytaert originally createdReturn to Rapture as a mod that merges the world of Biosh… [+1496 chars]",1
1,"NVIDIA has doubled the price of the GeForce Now premium plan to $10/month for new members. Annual plans cost $100/year. The Priority membership offers faster access to cloud gaming servers, longer ga… [+1732 chars]",1
2,"Isabel Kershner contributed reporting.
The Daily is made by Theo Balcomb, Lisa Tobin, Rachel Quester, Lynsea Garrison, Annie Brown, Clare Toeniskoetter, Paige Cowett, Michael Simon Johnson, Brad Fis… [+703 chars]",1
3,"image captionUp to 100mm (four inches) of rain is forecast for Sydney
Emergency authorities in Australia are warning of ""life threatening"" flash floods as torrential rains batter parts of the countr… [+1171 chars]",-1
4,"Welcome to Lodge, Lifehackers newest section exploring every aspect of home lifefrom the big questions (What does it really cost to buy a home?) to the small (Whats the best lightbulb for every room?… [+1460 chars]",1
5,"Israel’s ironSource, an app-monetization startup, is going public via a SPAC.
But before you tune out to avoid reading about yet another blank-check company taking a private company public, you’ll w… [+2870 chars]",-1
6,"Bramble-Carter, who identifies as mixed race, also attributes her enduring interest in clay to spending time in her fathers studio. When she studied at the Chelsea College of Arts in London, she was … [+2356 chars]",1
7,"Lucid Motors has designed the battery packs in its luxury electric vehicle for two lives. The company, which is already experimenting with energy storage systems for commercial and residential custom… [+5478 chars]",1
8,"More posts by this contributor
Your board will never be the same.
With that prediction, Nigel Travis, board director and former CEO of Dunkin and Papa Johns, kicked off a recent discussion about th… [+6239 chars]",1
9,"Bayern Munich beat PSG to win the Champions League in August 2020
It is being seen as the end of an era - but how is it that a 'new-look' Bayern Munich for next season is already looking like a form… [+4859 chars]",1
10,"(CNN) Photographer Faizan Ahmad had never even picked up a camera before he moved to Lahore, one of Pakistan's largest cities, in 2013.
But the 25-year-old student made it his mission to seek out as… [+7295 chars]",1
11,While plenty of services have user interfaces that are designed to be easy to useenough thateven a technophobe could figure them outtheres always going to be that moment where something looks weird a… [+4317 chars],1
12,"The lighting in a room isnt just part of the decor; it can affect everything from your sleep schedule to your brain power. So its understandable that you want your home, the place you presumably spen… [+11842 chars]",1
13,"Heres some of what you had to say. (These emails have been lightly edited and condensed.)
I have been a Republican and lifelong conservative. Voted for Trump twice. I grumbled about his tweets, but … [+5466 chars]",1
14,"The Station is a weekly newsletter dedicated to all things transportation. Sign up here just click The Station to receive it every Saturday in your inbox.
Hi friends and new readers, welcome to The … [+19545 chars]",1
15,"Mr. Kotto married three times; he and Ms. Sinahon, who is from the Philippines, wed in Baltimore in 1998.
Mr. Kotto had six children. Information on his survivors was not immediately available.
One… [+748 chars]",1
16,"A Texas man is facing federal charges after the authorities said he drove a pickup truck at speeds over 100 miles per hour during a police pursuit and crashed on Monday, killing eight undocumented im… [+1055 chars]",-1
17,"Even after we die, some of our brain cells can experience one last and large momentary burst of life, new research out Tuesday suggests. The study found evidence that certain zombie genes in our brai… [+3772 chars]",-1
18,"Many couples were forced to postpone their weddings because of the coronavirus, but that didnt stop some from deciding to start families anyway, ahead of getting married. Now, as restrictions are bei… [+463 chars]",-1
19,"They told me I was fragile, and so I became fragile. I was in middle school then. It felt as if my body had been taken away from me. They put me in a combination swing-dance-and-painting-class instea… [+2945 chars]",1
0,"What happened
Shares of Jiayin Group (NASDAQ:JFIN), Takung Art (NYSE: TKAT), and Hall of Fame Resort &amp; Entertainment Co. (NASDAQ: HOFV) are all flying today on news and speculation related to no… [+2793 chars]",1
1,"Shares of Takung Art  (TKAT) - Get Report leaped amid talk the Chinese-based online art trading platform will dive into the crypto art game.
And shares of Sino-Global Shipping America  (SINO) - Get … [+1622 chars]",1
2,"<ul><li>Gainers:&nbsp;Takung Art (NYSEMKT:TKAT) +122%
.</li><li>Zhongchao (NASDAQ:ZCMD) +52%
.</li><li>Oriental Culture (NASDAQ:OCG) +43%
.</li><li>Integrated Media Technology (NASDAQ:IMTE) +43%
… [+825 chars]",1
3,"<ul><li>RLX Technology (NYSE:RLX) -40%
.</li><li>Takung Art (NYSEMKT:TKAT) -16%
.</li><li>Turkcell Iletisim Hizmetleri (NYSE:TKC)&nbsp;-14%
</li><li>Farmmi (NASDAQ:FAMI) -13%
&nbsp;on proposed un… [+464 chars]",1
4,"<ul><li>Gainers:&nbsp;SunLink Health Systems (NYSEMKT:SSY) +219%
.</li><li>Can-Fite BioPharma (NYSEMKT:CANF) +53%
.</li><li>Savara (NASDAQ:SVRA) +37%
.</li><li>Fintech Acquisition (NASDAQ:FTCVU) +… [+840 chars]",1
5,"As a reminder, Marketsmith (by Investors Business Daily) is now a sponsor of the weekly show. All the charts you have been seeing in the videos and will continue to see are from Marketsmith. They are… [+2840 chars]",1
6,"NEW YORK, March 18, 2021 /PRNewswire/ -- InvestorsObserver issues critical PriceWatch Alerts for RIDE, TKAT, ZKIN, OCGN, and CCL.
To see how InvestorsObserver's proprietary scoring system rates thes… [+564 chars]",-1
7,"NEW YORK, March 19, 2021 /PRNewswire/ -- InvestorsObserver issues critical PriceWatch Alerts for SNDL, AMC, NIO, TKAT, and T.
To see how InvestorsObserver's proprietary scoring system rates these st… [+560 chars]",-1
8,"A grab bag of obscure stocks are soaring after unveiling plans to get involved in the exploding digital-art scene being powered by NFTs.
Non-fungible tokens, or NFTs, are cryptographic assets used o… [+1646 chars]",1
0,"""Apes Together Strong"" is a popular saying in Reddit's WallStreetBets forum, and some users are taking that seriously.
Reddit users have been symbolically adopting apes and donating to foundations i… [+236 chars]",1
1,"President Joe Biden's $1,400 stimulus checks are making their way - slowly - into the bank accounts of every adult US citizen and investors are keen to see which stocks the cash-fueled retail traders… [+7183 chars]",1
2,"In January this year, the WallStreetBets subreddit surprised the finance world when its massive user base bought up GameStop shares in numbers that couldn't be ignored. Now, those users are making a … [+1747 chars]",1
3,"Democrats took aim at aspects of zero-commission broker Robinhood at a House Financial Services Committee hearing Monday, calling on regulators to consider banning the practice of payment for order f… [+3830 chars]",1
4,Police say 21-year-old man charged with 10 murder countsBoulder police chief: I feel numb and its heartbreakingOfficer killed in Colorado shooting named as Eric Talley Boulder police released the nam… [+5225 chars],-1
5,"The twin peaks pattern in GMEs share price (January and February/March) has shocked the markets.  
GME's Twin Peaks - The January and February Surges 
Chart by author
There is no obvious fundament… [+15189 chars]",-1
6,"Robinhood users aren't so merry. 
James Martin/CNET
Popular investing app Robinhood became the focus of the controversy after it decided to freeze trades for GameStop on Jan. 28. Shares of the vide… [+9822 chars]",1
7,"Now that the coronavirus relief package is actually law, it is onto infrastructure for the Biden administration and its razor-thin Democratic majority in Congress. But infrastructure legislation will… [+4916 chars]",1
8,"GameStop announced on Tuesday that it has hired a tech industry veteran to join its executive team.
Jenna Owens will be the company's new COO after spending four years at Amazon, according to her Li… [+2104 chars]",1
9,"Arkema S.A., Akzo Nobel NV, PPG Industries, Inc., Axalta Coating Systems, RPM International, Inc., The Sherwin-Williams Company, Wacker Chemie AG, The Dow Chemicals Company, BASF SE, Kisco Limited, B… [+5153 chars]",-1
10,"Does high risk mean high reward? Not necessarily, so say the pros on Wall Street. Specifically citing penny stocks, or stocks that trade for less than $5 per share, analysts advise caution as these n… [+6747 chars]",1
11,"GameStop (GME), a WallStreetBets favorite and phenomena of the year, is set to report fourth quarter and fiscal year 2020 results Tuesday afternoon. The stock was trading about 5% lower by mid-sessio… [+3487 chars]",1
12,"By Cody GodwinBBC News, San Francisco
""Apes Together Strong"" is a popular saying in Reddit's WallStreetBets forum, and some users are taking that seriously.
Reddit users have been symbolically adop… [+2877 chars]",1
13,"The influx of retail traders into the markets has coincided with a rise in certain influencers with big followings on Finance Twitter, a trading-oriented section of the popular social media platform.… [+3211 chars]",1
14,"GameStop
 stock dropped again shortly after the market opened on Tuesday. While some short sellers appeared to cover their bearish bets in recent weeks, a short-selling expert says he still sees ple… [+1931 chars]",1
15,"So far, 2021 has been a rollercoaster of a year for Wall Street. Earlier this year, struggling businesses GameStop(NYSE:GME) and AMC Entertainment Holdings saw their stock prices skyrocket overnight,… [+3595 chars]",1
16,"It's finally Friday!
'When the 10-year goes up, it's bad for the the industrials,"" Cramer said as Dow industrials including Caterpillar  (CAT) - Get Report led markets lower in intraday trading Frid… [+1208 chars]",-1
17,"Bitcoin and cryptocurrency interest among Wall Street banks has exploded in recent monthsclimbing along with the surging bitcoin price. 
However, the bitcoin and cryptocurrency market remains relati… [+2224 chars]",1
18,"MOUNTAIN VIEW, CA - MAY 08: Aparna Chennapragada, vice president of Product for AR, VR and ... [+] Vision-based products speaks during the opening keynote address at the Google I/O 2018 Conference at… [+2009 chars]",1
19,"Smart stock investing shouldnt be emotional, but investors are only human, after all, making it difficult to follow a rational trading strategy. Investors should remember the advice of Warren Buffett… [+8198 chars]",-1
0,"Between now and March 30, roughly 6,000 Amazon workers in Bessemer, Alabama, will vote on forming the company's first ever union. 
The campaign has been contentious from the start: Amazon opposes th… [+6012 chars]",1
1,"In February, The Information reported on an instructional video for Amazon delivery drivers announcing a new suite of artificial intelligence-equipped cameras to surveil drivers during the entirety o… [+1585 chars]",1
2,"Amazon's internal affinity group representing Asian employees urged employees to show greater support for each other, following Tuesday's mass shooting in Atlanta that left eight people, including si… [+6441 chars]",1
3,"A rare photo has surfaced of a fateful meeting between Jeff Bezos and Elon Musk 17 years ago. 
The photo which was tweeted by Trung Phan, a writer for business newsletter The Hustle shows Musk and B… [+1578 chars]",1
4,"Palo Alto Networks Inc.s chief financial officer is leaving cybersecurity for videogames. 
Unity Software Inc. 
 U,
 +0.08%
announced Wednesday afternoon that it had hired Palo Alto Networks 
 P… [+869 chars]",1
5,"The National Football League has signed long term agreement with its media partners to distribute NFL games, the league announced on Thursday.
The NFL and its partners, who include CBS, ESPN/ABC , F… [+1329 chars]",1
6,"Advanced Micro Devices Inc.s third-generation server chip, code-named Milan, is expected to propel more sales for the chip maker in the computer server market.Earlier Monday, AMD 
 AMD,
 +1.79%
la… [+1777 chars]",1
7,"Federal and state antitrust enforcers told members of a House Judiciary subcommittee that monopoly power in America today is stronger than its been in generations, and asked for greater funding and n… [+2801 chars]",1
8,"Amazon-backed Deliveroo is expected to be valued at up to £8.8 billion when the food delivery app starts selling its shares on the London Stock Exchange 
 LSEG,
 +0.06%
,
 in what will be one of … [+3437 chars]",1
9,The 2021 Kia Forte touts its excellent features and warranty in taking on the 2021 Toyota Corolla. Heres how they compare.Above average: Roomy cabin; fuel-efficient engines; good handling; desirable … [+3906 chars],1
10,"Microsoft Corporation (NASDAQ: MSFT) is poised to chip away further market share from Amazon.com, Inc (NASDAQ: AMZN) cloud subsidiary Amazon Web Services, according to Wedbush Securities.
The Micros… [+2584 chars]",1
11,"[This article was first published on R Predictive Hacks, and kindly contributed to R-bloggers]. (You can report issue about the content on this page here)
Want to share your content on R-bloggers? c… [+666 chars]",1
12,"In the days leading up to yet another expected confrontation between Big Tech leaders and regulation-touting Congressional members, two of the three participating companies took conciliatory actions … [+6137 chars]",-1
13,"Oracles rising stock in the runup to the companys earnings this month caught investors attention, especially as momentum stocks lost their mojo. It disappointed just as quickly after the cloud-infras… [+5077 chars]",-1
14,The National Labor Relations Board accused Amazon of illegally interrogating and threatening a worker in New York City who was leading a walkout in March 2020 in response to the company's COVID-19 pr… [+2258 chars],-1
15,"Sen. Bernie Sanders is taking aim at the Americans who have made the most money during the economic downturn caused by the pandemic. On Wednesday, Sanders, an independent from Vermont, unveiled legis… [+5164 chars]",1
16,"From humble beginnings as an online bookstore, Amazon (AMZN) has evolved into one of the worlds biggest companies, with its remit spread across multiple sectors. However, Baird analyst Colin Sebastia… [+2501 chars]",1
17,"Contactless checkout technology has been around for several years, but as evidenced by retails newest unicorn, Standard Cognition, the time may finally be right for an expanded presence. 
Standard T… [+4069 chars]",1
18,"Photo by: zz/STRF/STAR MAX/IPx 2020 8/20/20 Businesses and retail stores in Manhattan on August 20, ... [+] 2020 as certain restrictions are eased as part of the Phase 4 Reopening in New York City du… [+3546 chars]",1
19,"It's finally Friday!
'When the 10-year goes up, it's bad for the the industrials,"" Cramer said as Dow industrials including Caterpillar  (CAT) - Get Report led markets lower in intraday trading Frid… [+1208 chars]",-1
0,"Image source: The Motley Fool.
Upstart Holdings, Inc. (NASDAQ:UPST)Q4 2020 Earnings CallMar 17, 2021, 4:30 p.m. ET
Contents:
<ul><li>Prepared Remarks</li><li>Questions and Answers</li><li>Call Par… [+48786 chars]",-1
1,"Commodity prices have historically run in cycles that often play out in a certain markets own worldcrude oil may rally, for example, while corn tumbleseach for separate reasons. But what happens if a… [+8715 chars]",1
2,"(Bloomberg) -- In early 2019, industrialist Sanjeev Gupta was trying to secure his biggest prize yet: a deal to buy a string of steel plants across Europe from ArcelorMittal SA. There was just one pr… [+6581 chars]",1
3,"With continued volatility in the stock market, TipRanks brings you the latest analyst action on some of your favorite stocks. Lets look into the noteworthy bullish and bearish calls of the day and se… [+4800 chars]",1
4,"Dow Jones futures rose modestly late Wednesday, along with S&amp;P 500 futures and Nasdaq futures. The stock market rally got a big boost from a dovish Federal Reserve policy announcement and Fed chi… [+6608 chars]",1
5,"Covid-19 lockdowns ignited demand for some outdoor fun, which has benefited leisure industry companies like IBD 50 member MarineMax (HZO). Sports and recreation equipment maker Vista Outdoor (VSTO) i… [+2994 chars]",1
6,"<ul><li>Upstart Holdings (UPST +86.6%
) climbs even higher with BofA Securities analyst Nat Schindler upgrading his rating on the stock to Buy from Neutral on stronger growth outlook and margin upsi… [+1013 chars]",1
7,"SAN MATEO, Calif.--(BUSINESS WIRE)--Upstart Holdings, Inc. (NASDAQ: UPST), a leading artificial intelligence (AI) lending platform, today announced financial results for its fourth quarter and fiscal… [+43724 chars]",1
8,"SAN MATEO, Calif.--(BUSINESS WIRE)--Upstart Holdings, Inc. (NASDAQ: UPST), a leading artificial intelligence (AI) lending platform, today announced it has entered into a definitive agreement to acqui… [+5321 chars]",1
9,"<ul><li>Gainers:&nbsp;Moxian (NASDAQ:MOXC) +92%
.</li><li>Jiayin Group (NASDAQ:JFIN)&nbsp;+82%
.</li><li>Upstart (NASDAQ:UPST) +78%
.</li><li>Dunxin Financial (NYSEMKT:DXF) +62%
.</li><li>Evolvin… [+857 chars]",1
10,"<ul><li>Gainers: Upstart Holdings (NASDAQ:UPST) +88%
. Dunxin Financial Holdings (NYSEMKT:DXF) +40%
. China Finance Online (NASDAQ:JRJC) +25%
. Hallmark Financial Services (NASDAQ:HALL) +17%
. Fi… [+291 chars]",1
11,"<ul><li>BioHiTech Global (NASDAQ:BHTG) +44%&nbsp;
on receiving $2M in Digester orders.</li><li>Upstart Holdings (NASDAQ:UPST) +39%
&nbsp;on Q4 results.</li><li>Neos Therapeutics (NASDAQ:NEOS) +30%… [+1531 chars]",1
12,"<ul><li>Gainers:&nbsp;Dolphin Entertainment (NASDAQ:DLPN) +163%
.</li><li>Benitec Biopharma (NASDAQ:BNTC) +88%
.</li><li>Liquid Media (NASDAQ:YVR) +51%
.</li><li>Takung Art (NYSEMKT:TKAT) +35%
.<… [+912 chars]",1
13,TheStreet recapped the best stories from this past week with Jim Cramer including stocks he would buy now. TheStreet also started its investing story series on SPACs with a story on how to invest in … [+4255 chars],1
14,"<ul><li>Upstart (NASDAQ:UPST): Q4 Non-GAAP EPS of $0.10 beats by $0.08
; GAAP EPS of $0.05 beats by $0.12
.</li><li>Revenue of $62.57M (-27.8% Y/Y) misses by $10.93M
.</li><li>Conversion on rate r… [+671 chars]",-1
15,"Stocks dropped at the starting bell, then rapidly turned mixed Thursday as rising bond yields, disappointing unemployment data and a spike in March manufacturing data fueled turbid early trade. New i… [+8538 chars]",-1
16,"Dow Jones futures rose slightly early Thursday while S&amp;P 500 futures fell and Nasdaq futures tumbled, as the 10-year Treasury yield moved above 1.7% for the first time since January 2020. That co… [+7383 chars]",1
17,"Every Friday, at 3 p.m. ET, Ritholtz Wealth Management CEO Josh Brown and Benzinga CEO Jason Raznick host ""The Boiler Room,"" a Clubhouse audio chat where listeners can pitch their favorite stock. Her… [+10173 chars]",1
18,"Like it or not, stocks are joined at the hip to the bond market, Jim Cramer told his Mad Money viewers Friday. It's a battle of value versus growth, the industrials versus technology, and these group… [+6887 chars]",1
19,"NEW YORK, March 19, 2021 /PRNewswire/ -- InvestorsObserver issues critical PriceWatch Alerts for SKLZ, ZKIN, IDRA, UPST, and PLUG.
To see how InvestorsObserver's proprietary scoring system rates the… [+565 chars]",-1
0,"Mark Zuckerberg has been the subject of countless memes, from a sunscreen-covered ride on his $12,000 electric surfboard to his robotic public speaking skills.
But it turns out that the Facebook CEO… [+1549 chars]",1
1,"Tech's biggest figures will once again appear before Congress on Thursday.
Google CEO Sundar Pichai, Twitter CEO Jack Dorsey, and Facebook CEO Mark Zuckerberg will face questioning from two Senate s… [+3153 chars]",-1
2,"There exists this Twitter account: azusagakuyuki.
It is essentially a repository of photos and tweets from what appears to be a female bike enthusiast in Japan.
The account currently has over 16,00… [+1273 chars]",1
3,Facebook Inc’s (NASDAQ: FB) social media app Instagram is close to revealing a new version of its photo-sharing tool targeted specifically for children under the age of 13 as it aims to woo the young… [+1563 chars],1
4,"Mark Zuckerberg, founder, chairman and chief executive of social media giant Facebook Inc., has raised nearly $200 million through hundreds of stock trades so far this month, as he converted nearly 5… [+1494 chars]",1
5,"Tom Brady may have just come off a record-breaking seventh Super Bowl championship, but hes not the king of NFL Instagram the same goes for the younger and talented Chiefs quarterback Patrick Mahomes… [+1870 chars]",1
6,"A ""dirty war"" causing suffering for ""defenceless"" victims is unfolding in Ethiopia's northern Tigray region, a general said in a briefing with diplomats last week, according to an audio recording of … [+2589 chars]",-1
7,"Hitting out at the ruling Trinamool Congress and the Left-Congress alliance in West Bengal, Prime Minister Narendra Modi on Saturday said that everyone was worried after WhatsApp, Facebook and Instag… [+2529 chars]",-1
8,"Amazon-backed Deliveroo is expected to be valued at up to £8.8 billion when the food delivery app starts selling its shares on the London Stock Exchange 
 LSEG,
 +0.06%
,
 in what will be one of … [+3437 chars]",1
9,"Facebook removed more than 1.3 billion fake accounts from its platform in the last three months of 2020, the company said on Monday. That period included heightened activity around the 2020 election … [+3602 chars]",-1
10,"Source: Joe Maring / Android Central
Messaging is a huge part of how we use our phones in our daily lives after all, these are communication tools, first and foremost. The best messaging apps are ge… [+24539 chars]",1
11,"Gerry Broome/Associated Press
The Los Angeles Chargers appear to have found their replacement for Hunter Henry.
ESPN's Adam Schefter reported the Chargers agreed to a one-year, $6 million contract … [+2074 chars]",1
12,"Chris O'Meara/Associated Press
Quarterback prospect Mac Jones did his best to boost his stock ahead of the 2021 NFL draft at Alabama's pro day.
Jones threw for scouts Tuesday, displaying his accura… [+2216 chars]",1
13,"In the days leading up to yet another expected confrontation between Big Tech leaders and regulation-touting Congressional members, two of the three participating companies took conciliatory actions … [+6137 chars]",-1
14,"A member of the San Francisco School Board referred to Asian Americans as house n****r[s] in a 2016 tweet thread, in a comment highlighted by the organizer of a movement to recall her. Alison Collins… [+5213 chars]",1
15,"Sen. Bernie Sanders is taking aim at the Americans who have made the most money during the economic downturn caused by the pandemic. On Wednesday, Sanders, an independent from Vermont, unveiled legis… [+5164 chars]",1
16,"The world is about to step out of a dark hole and into the bright sunshine, so investors should drop the anxiety already.That is the message from Alexander Ely, chief investment officer of U.S. equit… [+5787 chars]",1
17,"During my 20s, I was broke. I bought my first house and lived alone, stretched to my limits. I had three maxed-out credit cards and lived paycheck to paycheck.Today, Im in my 40s, married and in a mu… [+5171 chars]",-1
18,"THE SECOND Covid wave has been more severe in states like Punjab and Maharashtra as compared to other parts of the country. In Punjab itself, over 25,000 new cases and more than 400 deaths have surfa… [+3992 chars]",-1
19,"The Giants announced they have reached an agreement with former Texans FB Cullen Gillaspia.
Eli Penny is still on the roster, so why another fullback? Gillaspia is actually more of a special teamer,… [+321 chars]",1
0,Apple could soon face a major test of how strictly it plans to enforce its forthcoming app privacy policies after it emerged that some of China's biggest tech companies are testing a solution to skir… [+6728 chars],1
1,"March
16, 2021
3 min read
This story originally appeared on MarketBeat
With a 7% jump on Monday, shares of Skechers (NYSE: SKX) came within a few dollars of breaking out a long-term range. The ic… [+3188 chars]",1
2,"March
16, 2021
3 min read
This story originally appeared on MarketBeat
With a 7% jump on Monday, shares of Skechers (NYSE: SKX) came within a few dollars of breaking out a long-term range. The ic… [+3188 chars]",1
3,"Alphabet Inc.s 
 GOOG,
 +1.32%
Google is reducing the commission it charges developers that sell digital goods and services through its Play store, a move that comes amid increased regulatory scru… [+1318 chars]",1
4,"The redder the state, the more its residents are allowed and willing to move around.That might be intuitive given the reluctance of many conservatives to wear masks or take vaccines. And it is also b… [+1575 chars]",-1
5,"In this week’s topstories: Intel launches a new marketing campaign against Apple Silicon, iOS 14.5 beta 4 released, AirPods 3 and iPad Pro rumors, and more. Read on for all of this week’s top Apple s… [+5245 chars]",1
