,text,text_sent
4,"The Nasdaq 100 rebounded sharply Tuesday and held a bullish gain in afternoon trading. Tesla (TSLA), Baidu (BIDU), Peloton (PTON) and Pinduoduo (PDD) showed double-digit percentage gains in the Nasda… [+4194 chars]",1
5,"Written by Sam Kovacs
 Introduction
 The market is undergoing a shift from growth to value, and if as a momentum investor, you fail to catch the change, you'll be giving back a lot of your excess r… [+9861 chars]",1
6,"The question I get often these days: which expensive tech stocks have fallen far enough to considering buying? For the most part, I'm strongly of the opinion that the tech rout that began in mid-Febr… [+9549 chars]",-1
7,"When I published my article Get Your High Growth Shopping Lists Ready a little over 2 weeks ago I had a feeling a sell off was close, however the speed of the drop in high growth names has been nothi… [+8752 chars]",1
8,"Online gaming platform Roblox (RBLX) is set to begin trading Wednesday with an initial public offering that gives it an estimated value of $29 billion. The Roblox IPO will be a direct listing.
XWith… [+2552 chars]",1
9,<ul><li>Yam Finance and UMA protocol are launching uStonks on Degenerative Finance (DegenFi).</li><li>uStonks is a synthetic token that tracks an index of the ten most bullish stocks on the WallStree… [+2925 chars],1
10,"<ul><li>SuRo Capital&nbsp; (NASDAQ:SSSS) net asset value per share grew 22% in Q4, helped by the strong performance of Palantir in the public market.</li><li>Q4 net investment loss of 21 cents per sh… [+1993 chars]",1
11,This article is part of a series that provides an ongoing analysis of the changes made to Dan Loeb’s 13F stock portfolio on a quarterly basis. It is based on Third Point’s regulatory 13F Form filed o… [+14174 chars],1
12,You can only hate and love so much. The love for the cyclicals is so extreme that they have received valuations normally reserved for the Nvidia's (NVDA) of the world. By the Nvidia's? Who knows. Not… [+4147 chars],1
13,UKRAINE - 2021/02/19: In this photo illustration the stock market information of Snowflake Inc. seen ... [+] displayed on a smartphone with a logo of Snowflake in the background. (Photo Illustration … [+21584 chars],1
14,"Image source: The Motley Fool.
SuRo Capital Corp. (NASDAQ:SSSS)Q4 2020 Earnings CallMar 10, 2021, 5:00 p.m. ET
Contents:
<ul><li>Prepared Remarks</li><li>Questions and Answers</li><li>Call Partici… [+38458 chars]",-1
15,Palantir (PLTR) is my #1 bullish pick on the growth side of my portfolio. I started my position in PLTR on 10/26/20 and have purchased shares 12 times between $9.70 and $28.20. I stopped trying to ti… [+12768 chars],1
16,"Getty Images
Getty Images
Key Takeaways:
<ul><li>After sinking into correction territory, Nasdaq 100 
 NDAQ
 pops back overnight</li><li>10-year yield drops to 1.52%, but remains volatile and a … [+13419 chars]",1
17,"New York, March 12, 2021 /PRNewswire/ -- InvestorsObserver issues critical PriceWatch Alerts for PLTR, SLGG, PHUN, HGEN, and BTAI.
To see how InvestorsObserver's proprietary scoring system rates the… [+565 chars]",-1
18,"Most weeks, the Commonwealth Bank of Australia (ASX: CBA) CommSec brokering platform tells us the ASX and international shares (usually just US shares) that are the most popular with its Australian c… [+3699 chars]",1
19,"Listen on the go! A daily podcast of Wall Street Breakfast will be available by 8:00 a.m. on Seeking Alpha, iTunes, Stitcher and Spotify.
Correcting the correction?
The Nasdaq is leading the charge… [+8761 chars]",1
0,"For years, comparisons between Apple and Tesla haven't merely been commonplace they've been expected. 
Some of this could be chalked up to timing. Apple co-founder and CEO Steve Jobs died in 2011, l… [+5195 chars]",-1
1,"As discussions between several traditional automakers and Apple have reportedly fizzled, industry experts think that the on-again-off-again Apple Car project could rely on a contract manufacturer to … [+4793 chars]",1
2,"Fridays momentum melted away like snow in the March sun. Then it appeared to come back, at least for parts of Wall Street. The Nasdaq (COMP) isnt one of them. Things didnt start out all over the plac… [+13086 chars]",1
3,"Investment bank Morgan Stanley calls recent reports of weaker iPhone demand ""supply chain noise,"" and sees the AAPL pullback as a buying opportunity for investors.
In a note to investors seen by App… [+2708 chars]",-1
4,"The Dow Jones Industrial Average rose but the Nasdaq slumped as bond yields jumped, sending tech stocks lower while cyclicals and financials outperformed.
XThe Dow Jones industrials held a 0.5% gain… [+4843 chars]",-1
5,"In this week’s topstories: iOS 14.4.1 brings important security fixes for iPhone users, the future of the iMac Pro and HomePod, Apple event rumored for March 28, and more. Read on for all of this wee… [+5347 chars]",1
6,"Apple will invest more than 1 billion ($1.2 billion) over the next three years to create Europes largest research and development site for mobile wireless semiconductors and software, the technology … [+2099 chars]",1
7,"Smartphone shipments in China are experiencing a worse-than-seasonal decline despite starting 2021 off strong, according to investment bank JP Morgan.
In a note to investors seen by AppleInsider, le… [+2206 chars]",1
8,"Investment bank Wedbush says that the recent Apple stock sell-off creates a ""golden buying opportunity"" for investors, and predicts that Apple still has a $3 trillion valuation on the horizon.
In a … [+2220 chars]",1
9,"Apple Inc. shares are off more than 16% from their January highs, but one analyst argues that investors should take advantage of the dip to seize upon a golden buying opportunity. Wedbushs Daniel Ive… [+2624 chars]",1
10,"Goldman Sachs has pledged to invest $10 billion over the next decade in an initiative to improve the economic standing of Black women, which will focus on areas including access to capital, housing, … [+3511 chars]",1
11,"It doesnt get as much investor attention as the broad S&amp;P 500 index
 SPX,
 +1.39%
or the sexy innovators of the Nasdaq Composite
 COMP,
 +2.62%
,
 but a closer look at the Dow Jones Indust… [+2509 chars]",1
12,"The Dow Jones Industrial Average hit a new record high on encouraging new data, while President Joe Biden is getting set to sign the Covid stimulus bill. New listing Roblox (RBLX) sprinted higher in … [+8899 chars]",1
13,"(Bloomberg) -- Warren Buffett has been a fixture at the top of the worlds wealth rankings for decades, but in recent years hes slipped down the list as tech fortunes soared and his hot hand cooled.No… [+3318 chars]",1
14,"How are you? Its been quite a year.Its exactly one year since the World Health Organization declared the coronavirus public-health emergency a pandemic. Looking back, we can see how far we have come,… [+5419 chars]",-1
15,"(Bloomberg) -- The pandemic housing rally is getting its first big test.Mortgage rates rose in each of the past three weeks, driven by a bet that inflation will accelerate as the U.S. economy roars b… [+3811 chars]",1
16,"The Dow Jones Industrial Average on Wednesday closed above the psychologically significant 32,000 level, registering a milestone during a turbulent period for the stock market as the economic recover… [+4347 chars]",1
17,"The Dow Jones Industrial Average 
 DJIA,
 +1.46%
finished above 32,000 points for the first time and bond yields are falling globally. And there is a good chance this period of calm in bonds will … [+5306 chars]",1
18,"Saturna Capital Corporation, an investment management firm, published its fourth-quarter 2020 Amana Mutual Funds Trust Investor Letter a copy of which can be downloaded here. In the past year, a retu… [+2857 chars]",1
19,"Theres been much talk in recent days, as Apples market cap has slipped at points to sit below the US$2 trillion mark. Cult of Mac shared a timely reminder of when AAPL first overtook Walmart stock.At… [+747 chars]",1
0,"Tesla's determination to restart EV production at its Fremont factory last May appears to have had some consequences. According to the Washington Post, PlainSite has obtained Alameda County health da… [+1955 chars]",1
1,"For years, comparisons between Apple and Tesla haven't merely been commonplace they've been expected. 
Some of this could be chalked up to timing. Apple co-founder and CEO Steve Jobs died in 2011, l… [+5195 chars]",-1
2,"Yet another startup is entering the battery-powered pickup arena. And this latest entry may just have the quirky looks needed to take on the upcoming Tesla Cybertruck. 
Electric-vehicle firm Canoo o… [+2523 chars]",1
3,"Tesla is known to quietly raise and lower is prices whenever it sees fit.
In October, Tesla CEO Elon Musk dropped the price of the Model S sedan to $69,420 after rival Lucid announced its sedan woul… [+4923 chars]",1
4,"The bounce back in technology stocks does not spell the end of the market's rotation into cyclicals, says UBS, which suggested investors take advantage of volatility to add exposure to fintech and ot… [+2175 chars]",1
5,"Swiss investment bank UBS just took a deep-dive into what it's saying is the most credible electric vehicle effort by a legacy automaker so far.
UBS analysts have been examining every aspect of the … [+4197 chars]",1
6,"Hundreds of COVID-19 cases were reported at Tesla Inc.s production plant in Fremont, Calif., after it reopened last May in defiance of local health regulations, according to a new report.Teslas plant… [+1996 chars]",1
7,"Elon Musk recently revealed that Tesla
 is set for an updated release of the Cybertruck sometime during the second quarter of this year.
This announcement comes more than a year since the electric … [+1412 chars]",1
8,"Shares of Tesla Inc. and Nio Inc. rallied Thursday, after Mizuho analyst Vijay Rakesh recommended investors buy the respective leaders in their electric vehicle markets, while setting bullish price t… [+3348 chars]",1
9,"Swedish battery maker Northvolt has snapped up Cuberg to gain access to the Silicon Valley startups technology, which will boost the energy density and range of electric-vehicle batteries.Northvolt, … [+3575 chars]",1
10,"The Dow Jones Industrial Average hit a new record high on encouraging new data, while President Joe Biden is getting set to sign the Covid stimulus bill. New listing Roblox (RBLX) sprinted higher in … [+8899 chars]",1
11,"GOTHENBURG, SWEDEN - 2019/09/14: An American automotive and energy company that specialises in ... [+] electric car manufacturing Tesla logo seen in Gothenburg. (Photo by Karol Serewis/SOPA Images/Li… [+7065 chars]",1
12,(Bloomberg) -- An upstart contender to U.S. Treasuries has emerged in the wake of last months vicious debt rout.Chinese government bonds have defied the turbulence rocking peers from Australia to Eur… [+5805 chars],-1
13,"Tesla Inc (NASDAQ: TSLA) pays significantly less than its rivals for lithium battery cells and has the lowest cost EV battery packs, according to Cairn Energy Research Advisors, CNBC reported Wednesd… [+2696 chars]",-1
14,"The recent tech-led rebound seen on the Nasdaq may be short-lived, according to Jeremy Siegel, a finance professor at the Wharton School, CNBC reported Tuesday. What Happened: Siegel was less than up… [+2220 chars]",1
15,"Over the past several weeks, fears of rising long-term interest rates and inflation have helped push down shares of many large technology companies. At the same time, value stocks those of slower-gro… [+3777 chars]",1
16,"Renault sold its stake in rival auto giant Daimler on Friday, injecting cash into the companys strategy for a multiyear turnaround focused on increasing profitability and pivoting toward the next gen… [+4147 chars]",1
17,(Bloomberg) -- The U.S. and China are pursuing divergent economic policies in the aftermath of the coronavirus recession in a role reversal from last time the world economy was recovering from a shoc… [+6389 chars],-1
18,"Elon Musk said in December that hes confident SpaceX will be able to land humans on Mars by 2026. Sadly, there are many obstacles to this ambitious plan, and his dreams of terraforming the Red Planet… [+4954 chars]",1
19,"The Dow Jones Industrial Average 
 DJIA,
 +1.46%
finished above 32,000 points for the first time and bond yields are falling globally. And there is a good chance this period of calm in bonds will … [+5306 chars]",1
0,"GameStop is back in the spotlight with big upside moves in recent sessions, but new data suggest the price action might not be being spearheaded by retail investors as it was during the January rally… [+2955 chars]",1
1,"GameStop has been the centre of markets' attention this week
Spencer Platt/Getty
Shares of GameStop experienced a wild trading session on Wednesday reminiscent of the late January short-squeeze tha… [+1237 chars]",1
2,"The Dow Jones Industrial Average hit a new record high on encouraging new data, while President Joe Biden is getting set to sign the Covid stimulus bill. New listing Roblox (RBLX) sprinted higher in … [+8899 chars]",1
3,"GME to the moon.
Getty Images
GameStop stock didn't slow down Tuesday, with the share price continuing to climb, to $246.90, a 26% increase from where it opened. This came after a buying frenzy on … [+1340 chars]",1
4,"GameStop millionaire Roaring Kitty
Roaring Kitty
<ul><li>GameStop surged as much as 14% on Friday as it resumed its push to levels not seen since after the epic short-squeeze earlier this year.</li… [+2643 chars]",1
5,"A version of this story first appeared in CNN Business' Before the Bell newsletter. Not a subscriber? You can sign up right here.
London (CNN Business)Wall Street threw a party as President Joe Bide… [+6061 chars]",1
6,"Shares of GameStop Corp. shot higher again Tuesday, closing at its highest point since the end of January and pushing its market cap back above $17 billion.
After plunging about 90% from its highs o… [+1108 chars]",1
7,"Great articles, every Saturday.",1
8,"GME to the moon.
Getty Images
GameStop stock continues its rebound on Wednesday as shares jumped to over $325 in morning trading, a 31% increase from the opening bell. This follows a buying frenzy … [+2379 chars]",1
9,"Vexed by Wednesdays repeated halts in 
GameStop Corp. shares, day traders were left grasping for clues on where the stocks chaotic journey would pick up after the restrictions were lifted.
They did… [+1617 chars]",-1
10,GameStop Corp. shares Wednesday were on track for their highest closing price in history and their longest winning streak since the videogame retailers stock became the poster child for Reddit-inspir… [+2616 chars],1
11,"AMC Entertainment Holdings Inc. reported a loss of nearly $1 billion in the holiday season to wrap up a woeful year of closed movie theaters, but executives sounded a hopeful note for reopening in 20… [+2513 chars]",1
12,"The wallstreetbets-reddit crowd are at it again, pushing GameStop (GME) stock back up to near 250.
XThe prior short squeeze saw GME stock rise rapidly to 483.
Let's assume we think that high won't … [+2496 chars]",1
13,"GameStop (GME) has had considerable momentum since consolidating around $50. After a brief period of consolidation around ~$110-130, GME has broken out again with a ~40% move today (3/8/2021). With t… [+10815 chars]",-1
14,"GameStop (GME) shares were surging more than 20% during Tuesday morning's session, extending a five day rally. The stock closed 41% higher yesterday after news that activist investor and board member… [+1880 chars]",1
15,Retail trading has captured the attention of the financial world over the past year as first-time investors have poured money into the stock market. More than 10 million new brokerage accounts were c… [+5168 chars],1
16,"Listen on the go! Subscribe to the SA for FAs podcast on Apple Podcasts, Stitcher and Spotify (click the highlighted links). 
 The lesson I take from the GameStop (NYSE:GME) affair is that the stock… [+481 chars]",1
17,"If you get your stock tips from preteens, you likely know that as of Wednesday, Roblox is a public company. The online gaming platform is one of the pandemics success stories, having seen tremendous … [+7465 chars]",1
18,"President at AudateMedia. We create content marketing for Small to Large Sized Businesses to engage new clients from Online to your Door. 
getty
GameStop's stock (GME) price is at $118.02 as of thi… [+5273 chars]",1
19,"In the latest trading session, GameStop (GME) closed at $260, marking a -1.89% move from the previous day. This change lagged the S&amp;P 500's daily gain of 1.04%. Meanwhile, the Dow gained 0.58%, a… [+2293 chars]",1
0,"Shares of Box, a well-known content-and-collaboration company that went public in 2015, rose today after Reuters reported that the company is exploring a sale. TechCrunch previously discussed rising … [+2838 chars]",1
1,"Getting rid of smartphone excess is hard. Just ask Apple. When it launched the iPhone 12 series without chargers or headphones in the box, the company had to immediately accommodate French laws by in… [+4024 chars]",1
2,"Netflix, email, Zoom its all in one place, so no matter what you do, it never stands out, he said. I felt at least with an object, it occupies space and a moment in time. You interact with it physica… [+1220 chars]",-1
3,"Among many botanical relationships, Mr. Bowen has had a pineapple lily (Eucomis) phase, and a run of red hot pokers (Knifophia). An ongoing affair with Hydrangea included the introduction of H. serra… [+1386 chars]",1
4,"The importance of the pitch deck cant be underestimated. It is often the first point of contact between a company and venture investors, but how investors consume a pitch deck (and what they really t… [+1502 chars]",1
5,"For cord-cutters who don't get all of their TV via streaming, Tablo's DVRs record over-the-air broadcasts and make them available for viewing on screens of many sizes. Late last year Tablo released a… [+1523 chars]",1
6,"March
18, 2021
4 min read
Opinions expressed by Entrepreneur contributors are their own.
Behind the Review host and Yelp’s Small Business Expert, Emily Washcovick, shares a look at this week’s ep… [+3894 chars]",1
7,"Martin Luther King III is a global human rights advocate, chairman of the board at the Drum Major Institute and son of Martin Luther King Jr. and Coretta Scott King. The views expressed in this comme… [+5190 chars]",1
8,"The trick to a fun escape room is layers. For [doktorinjh]’s Spacecase, you start with an enigmatic aluminum briefcase and a NASA drawstring backpack. A gamemaster reads the intro speech to set the m… [+1005 chars]",1
9,"Karim Benzema has scored 21 goals for Real Madrid this season, 15 more than any other player
Real Madrid reached the Champions League quarter-finals for the first time in three seasons with a clinic… [+3714 chars]",1
10,"By Reuters Staff
LONDON (Reuters) - The 1998 Northern Irish peace deal is under threat and a Pandoras box of protest and political crisis will be opened unless the European Union agrees to significa… [+1078 chars]",-1
11,"LOS ANGELES (Variety.com) - Disneys animated adventure Raya and the Last Dragon led the domestic box office in its third weekend, illustrating the appeal of family films as Hollywood attempts to moun… [+4451 chars]",1
12,"(Reuters) - U.S. cloud services provide Box Inc is exploring a sale amid pressure from hedge fund Starboard Value LP over its stock performance, according to people familiar with the matter.
Redwood… [+1538 chars]",1
13,"Messi scored two and assisted Sergino Dest's first Barcelona goal
Lionel Messi celebrated a record-breaking 768th appearance for Barcelona with two goals as the Spanish giants thrashed Real Sociedad… [+3795 chars]",1
14,"Kotaku EastEast is your slice of Asian internet culture, bringing you the latest talking points from Japan, Korea, China and beyond. Tune in every morning from 4am to 8am.
Slowpoke might not exactly… [+1017 chars]",1
15,"In the 20 years since the Academy of Motion Picture Arts and Sciences introduced the Oscar for Best Animated Feature, a hand-drawn movie has claimed the award only onceJapanese director Hayao Miyazak… [+2025 chars]",1
16,"If it was up to you, you'd buy your cat a new toy every day, but your bank account wouldn't like that too much. Sometimes it's better to wait until things go on sale.
Luckily for you and your feline… [+2063 chars]",1
17,"Tottenham responded to their shock Europa League exit in midweek with a hard-fought Premier League victory over Aston Villa that keeps Jose Mourinho's side in the hunt for a top-four finish.
They we… [+5927 chars]",-1
18,"Jensen Karp, a comedian and writer whose TV credits include Unleashed and The Masked Singer, has made waves on Twitter after claiming that he found two shrimp tails in a box of Cinnamon Toast Crunch.… [+2617 chars]",1
19,"He was just getting to the rim and it was like a trampoline, Udo-Ema said. Like a pogo stick. Bing, bing, bing, bing, bing. He was like Shawn Marion at seven feet.
Analysts have compared Evan to see… [+887 chars]",1
0,"Photo: Pim de Groot (@mifune) / Twitter

 

 USB-C ports, I am occasionally forced to admit, are somewhat confusing. Different standards, different charging speeds, different data and video capabili… [+2374 chars]",-1
1,"For cord-cutters who don't get all of their TV via streaming, Tablo's DVRs record over-the-air broadcasts and make them available for viewing on screens of many sizes. Late last year Tablo released a… [+1523 chars]",1
2,"1 with 1 posters participating
<ul><li>
</li><li>
 There is quite a bit of engineering going on here. 
</li><li>
 It also came in space gray. 
</li><li>
 It's a pretty nondescript device, but … [+3135 chars]",1
3,"Signal is testing a new wifi transfer tool for Android users that will let you port your message history to a new device, much like the phone-to-phone transfer Signal added to iOS last year. 
Prior … [+2658 chars]",1
4,"iOS 14.5 should be right around the corner, judging by the four developer betas were at right now. At this point, I wouldnt begrudge anyone who wanted to give the updated operating system a try on th… [+2092 chars]",1
5,"March
23, 2021
4 min read
Opinions expressed by Entrepreneur contributors are their own.
Not many people have experienced the joy of buying a profitable business: Systems are set, processes in pl… [+3805 chars]",1
6,"This is a hot little hatch.
Peugeot
After years of promising that Peugeot would return to America, parent company Stellantis last month announced that those plans have been canned in favor of focus… [+3785 chars]",1
7,"Nvidias deep-learning supersampling (DLSS) tech feels like magic. It makes 4K games run like theyre rendering at 1080p. But it obviously isnt magic, because not every game supports it. Developers nee… [+2398 chars]",1
8,"TL;DR: Google Stadia is bundling free Stadia Premiere Edition systems with all preorders of Resident Evil Village. 
Many refer to the concept of cloud gaming and streaming as the future of the mediu… [+1600 chars]",-1
9,"Posted 
The video game industry has had a year like none other. With consumers stuck at home and money to spend on home entertainment, shares in video game makers have soared. But now that a year of… [+194 chars]",1
10,"The UK government is about to deal a blow to consumers and unexpectedly change the rules of its plug-in car grant. The changes will make a number of popular EVs less attainable than before, particula… [+1811 chars]",1
11,LONDON (Reuters) - Ford Motor Co said on Tuesday that the next version of its Transit van for the European market will go into production in Turkey in 2023 and include fully electric and hybrid varia… [+1342 chars],1
12,"TL;DR: A Degoo Premium: Lifetime 10TB Backup Plan is on sale for £107.79 as of March 18, saving you 95% on list price.
The only thing worse than losing all of your precious photos, videos, and files… [+1798 chars]",-1
13,"But using race to estimate ones cognition is fraught because it does not account for factors like a persons health, education or economic background. Many people such as those who come from biracial … [+2031 chars]",1
14,"Not all advice need be professional. Sometimes your problems merit a bit of unvarnished honesty from a dude equipped with nothing more than a computer and a conscience. Luckily for you, Im that guy. … [+5596 chars]",1
15,"Back in 1921, Dr. Charles P. Steinmetz, the pioneering inventor and mathematician, was published in a Massachusetts newspaper predicting what the fantastical world of 2021 would look like. Steinmetz … [+6864 chars]",1
16,"The PS5 and Xbox Series X may be the newest consoles on the block, but retro gaming has made its own comeback in recent yearsfrom re-imaginings of classic Mario to replicas of the consoles themselves… [+4087 chars]",-1
17,A good chunk of the $164.9 million the 49ers spent in free agency went to adding two of the best blockers in football to protect quarterback Jimmy Garoppolo against the N.F.C. Wests aggressive pass r… [+2806 chars],1
18,"By Reuters Staff
FILE PHOTO: A Geely Xingyue Coupe SUV is seen displayed at the second media day for the Shanghai auto show in Shanghai, China April 17, 2019. REUTERS/Aly Song
BEIJING (Reuters) - G… [+1225 chars]",1
19,"By Reuters Staff
BEIJING, March 15 (Reuters) - Geely said on Monday it would build an electric vehicle battery factory with a planned annual manufacturing capacity of 42 gigawatt hours (GWh) in Chin… [+1145 chars]",1
