,text,text_sent
0,"The crypto bull market remains in full throttle. This has been good news for Nvidia (NVDA). The chip giant sells the GPUs used as crypto mining rigs, providing the company with another stream of reve… [+2648 chars]",1
1,"Mairs &amp; Power, an investment management firm, published its fourth-quarter 2020 Growth Fund Investor Letter a copy of which can be downloaded here. A return of 13.88% was recorded by the fund in … [+2944 chars]",1
2,"Nvidia  (NVDA) - Get Report has been a bit of an anomaly. It hasn’t participated in the rally that growth stocks have seen for the last several quarters, but it’s not exactly considered a FAANG holdi… [+2404 chars]",1
3,You can only hate and love so much. The love for the cyclicals is so extreme that they have received valuations normally reserved for the Nvidia's (NVDA) of the world. By the Nvidia's? Who knows. Not… [+4147 chars],1
4,"Nvidia Corp.s stock and the broader chip sector logged their best days in nearly a year as beaten-down tech stocks staged a rally Tuesday. Nvidia 
 NVDA,
 +8.03%
shares finished up 8% at $500.81, … [+1486 chars]",1
5,"As I teach my Millennial son some good investment strategies for winning in the stock market over the long-run -- like sector allocation, which/how many ETFs to buy, tax-deferred vehicles, time horiz… [+9184 chars]",1
6,"Volatility in Nvidia (NVDA) has picked up in the weeks following its quarterly results, which the market seemed unhappy with. The problem goes beyond those results because the market dynamics have la… [+3365 chars]",-1
7,"Reasonable investors can (and do) disagree about what Bitcoin (CCC:BTC-USD) should be worth. Personally, I think the current price above $55,000 is questionable at best and a bubble at worst. Many cr… [+10511 chars]",-1
8,"U.S. largest bank launches a crypto-related stock basket, raising questions about the true extent of ... [+] exposure to bitcoin and other cryptocurrencies.
LightRocket via Getty Images
JPMorgan 
… [+4653 chars]",1
9,"Contrary to what you may have heard, Republicans and Democrats do not disagree on everything. When it comes to the growing economic challenge posed by China, they seem to share similar anxieties.
Ex… [+6179 chars]",1
10,"Reasonable investors can (and do) disagree about what Bitcoin (CCC:BTC-USD) should be worth. Personally, I think the current price above $55,000 is questionable at best and a bubble at worst. Many cr… [+11272 chars]",-1
11,"Reasonable investors can (and do) disagree about what Bitcoin (CCC:BTC-USD) should be worth. Personally, I think the current price above $55,000 is questionable at best and a bubble at worst. Many cr… [+11272 chars]",-1
12,"NVDA is Gaming
(NVDA GPUs. Source: NVDA Newsroom)
 It is difficult to have a conversation on Nvidia (NVDA) without talking about its Gaming segment, which has maintained its position over the years… [+19664 chars]",-1
13,"Reasonable investors can (and do) disagree about what Bitcoin (CCC:BTC-USD) should be worth. Personally, I think the current price above $55,000 is questionable at best and a bubble at worst. Many cr… [+11272 chars]",-1
14,"Overview
 Video Gaming and eSports ETF (ESPO) by VanEck offers an attractive opportunity to jump on to a quickly growing multi-billion dollar gaming and eSports industry while diversifying risk. As … [+7090 chars]",1
15,"Stocks enjoyed a day of widespread gains in the wake of promising employment data and the finalization of a much-anticipated booster shot to the economy.
The Labor Department said Thursday that firs… [+3093 chars]",1
16,"A 10% correction is rattling big Nasdaq stocks even as the S&amp;P 500 holds on. And that gap is creating a trillion-dollar moneymaking opportunity for investors, analysts say.
XEight Nasdaq 100 sto… [+4669 chars]",1
17,"The Nasdaq Composite, doing its best impersonation of a pendulum of late, swung hard in the bulls' direction Tuesday with its best one-day performance in roughly four months  just one day after falli… [+2586 chars]",1
18,"Reasonable investors can (and do) disagree about what Bitcoin (CCC:BTC-USD) should be worth. Personally, I think the current price above $55,000 is questionable at best and a bubble at worst. Many cr… [+11402 chars]",-1
19,"Reasonable investors can (and do) disagree about what Bitcoin (CCC:BTC-USD) should be worth. Personally, I think the current price above $55,000 is questionable at best and a bubble at worst. Many cr… [+11272 chars]",-1
0,"The Russian government ordered on Wednesday a general slowdown of Twitters connection speed, after what it called systematic disregard of the requirement to remove content forbidden in Russia.
<ul><… [+1419 chars]",-1
1,The Atlantic Coast Conference has canceled a tournament game between No. 16 Virginia and Georgia Tech because of a positive COVID-19 test for people in the Virginia program.The ACC announced the canc… [+1966 chars],1
2,"GDS Investments, an investment management firm, published its year-end investor letter a copy of which can be seen here. In the letter, the fund talked about the negative impact brought about by the … [+3452 chars]",-1
3,"Twitter has filed a lawsuit against Texas Attorney General Ken Paxton, claiming the Republican used his office to retaliate against it for banning the account of former President Donald Trump followi… [+3906 chars]",-1
4,"The bank assessed the individual stocks in statistical terms, based on two factors. First is how widely held the shares are, measured by the percentage of their market capitalization held by institut… [+2766 chars]",1
5,"<ul><li>Russia is slowing Twitter's (NYSE:TWTR) speed following similar actions by governments in Turkey and India, which have also threatened jail time for platform executives.</li><li>What happened… [+612 chars]",-1
6,"When it comes to getting women into technology roles, the issue is no longer a shortage of skills, but a lack of commitment to hiring and retaining female talent, according to the founder and CEO of … [+3015 chars]",1
7,"In this article, we take a look at billionaire Michael Price's top 10 stock picks. You can skip our detailed discussion of Prices history, his hedge funds performance and go to Billionaire Michael Pr… [+9612 chars]",1
8,"TwitterCEO Jack Dorsey is auctioning off an important piece of the social media platform's history.
Dorsey shared a link to digital auctioning platform Valuable on Saturday, which shows his very fir… [+4319 chars]",1
9,"Every week, Benzinga conducts a survey to collect sentiment on what traders are most excited about, interested in or thinking about as they manage and build their personal portfolios. This week we po… [+4056 chars]",1
10,"Every week, Benzinga conducts a survey to collect sentiment on what traders are most excited about, interested in or thinking about as they manage and build their personal portfolios. This week we po… [+4056 chars]",1
11,"With another round of federal stimulus on the way and expectations for solid growth for the U.S. economy this year, value stocks have been rallying. Stocks with low valuations tend to do well during … [+6570 chars]",1
12,"March
10, 2021
4 min read
This story originally appeared on StockNewsSocial networking platform Twitter, Inc. (TWTR - Get Rating) has gained 24.7% so far this year, to close yesterday’s trading se… [+4307 chars]",1
13,"The pandemic forced companies into finding ways for employees to work remotely from home. In order to make this a possibility, companies harnessed technology to allow businesses to continue to operat… [+2881 chars]",-1
14,"Source
 Valuation is generally the last thing I look at in my analysis before making an investment decision.
 Many investors overlook the fact that valuations vary dramatically based on industry, g… [+32960 chars]",1
15,"Listen on the go! A daily podcast of Wall Street Breakfast's Alpha Talks will be available this morning on Seeking Alpha, iTunes, Stitcher and Spotify.


 
 
 

 

 
More Wall Street Breakfast Pod… [+12085 chars]",1
16,Whitney Tilson’s email to investors discussing Nasdaq falls into correction territory; his short squeeze bubble basket is now down 41%; SPAC-Man Chamath Palihapitiya; Questions about a SPAC mogul’s s… [+5801 chars],1
17,"In this article, we will take a look at the 15 Most Valuable Australian Companies. You can skip our detailed analysis of Australia's economy and go to the 5 Most Valuable Australian Companies.
Austr… [+11627 chars]",1
18,"NEW RESOURCES 
Google Blog: Music, Makers &amp; Machines. “Music, Makers &amp; Machines, the new exhibit from Google Arts &amp; Culture and YouTube, celebrates the history of electronic music: its i… [+5425 chars]",1
19,"Listen on the go! A daily podcast of Wall Street Breakfast will be available by 8:00 a.m. on Seeking Alpha, iTunes, Stitcher and Spotify.
Crypto Art 
NFTs are becoming wildly popular among investor… [+8438 chars]",1
0,"Jay Reeves/Associated Press
The NFL Players' Association released a statement Thursday supporting Amazon warehouse workers who are attempting to unionize, noting that ""everyone deserves to have a vo… [+526 chars]",1
1,"The Dow Jones Industrial Average hit a new record high on encouraging new data, while President Joe Biden is getting set to sign the Covid stimulus bill. New listing Roblox (RBLX) sprinted higher in … [+8899 chars]",1
2,"The Dow Jones Industrial Average 
 DJIA,
 +1.46%
finished above 32,000 points for the first time and bond yields are falling globally. And there is a good chance this period of calm in bonds will … [+5306 chars]",1
3,"Amazon (AMZN) closed the most recent trading day at $3,113.59, moving +1.83% from the previous trading session. This move outpaced the S&amp;P 500's daily gain of 1.04%. At the same time, the Dow add… [+2907 chars]",1
4,"GettyAny interview conducted with Meghan Markle and Prince Harry was going to be juicy, especially at this stage of their royal exodus and in the midst of such a treacherous tabloid maelstrom.But onl… [+9697 chars]",1
5,"CAMBRIDGE, U.K. (Project Syndicate)Following the tenfold growth of Teslas stock 
 TSLA,
 +19.32%
between March 2020 and January 2021, the companys founder, Elon Musk, has emerged as the avatar of … [+7047 chars]",1
6,"Amazon is adding new employee healthcare centers in Michigan and California as part of its larger effort make accessing healthcare easier for its workers.
Last year, Amazon partnered with Crossover … [+2427 chars]",1
7,"Nvidia  (NVDA) - Get Report has been a bit of an anomaly. It hasn’t participated in the rally that growth stocks have seen for the last several quarters, but it’s not exactly considered a FAANG holdi… [+2404 chars]",1
8,"Bitcoin has surged back this week after its early 2021 bull run slowed, with the 18.6 million bitcoin tokens in circulation again worth over $1 trillion. 
The bitcoin price added almost 10% over the… [+2455 chars]",1
9,"The controversy provoked by Oprah Winfreys interview with Britains Prince Harry and his wife, Meghan Markle, has produced a division between those who assume that the British royal family is eminentl… [+6947 chars]",-1
10,"Much of Dufry's EMEA estate, like this World Duty Free store at London Heathrow, remains closed.
World Duty Free store at London Hethrow 
More flexible travel and fewer, or less stringent, travel b… [+3532 chars]",1
11,"Business success concept and happy new year idea Photo by Getty
getty
I have just read a summary of what will happen in the future. It is exciting but also a little scary. It suggests that retailer… [+3582 chars]",1
12,"SEATTLE--(BUSINESS WIRE)--(NASDAQ: AMZN) Amazon Music today announced the integration of artist merchandise within its mobile app, combining the convenience customers have come to know and love from … [+6504 chars]",1
13,This article is part of a series that provides an ongoing analysis of the changes made to Robert Karr’s 13F stock portfolio on a quarterly basis. It is based on Karr’s regulatory 13F Form filed on 2/… [+5489 chars],1
14,"The recent tech-led rebound seen on the Nasdaq may be short-lived, according to Jeremy Siegel, a finance professor at the Wharton School, CNBC reported Tuesday. What Happened: Siegel was less than up… [+2220 chars]",1
15,"Plot: CHAD (Neysser Swords) is a fighter who seeks to be the best without losing his principles. In the search for his dream, he meets VINCENT (Humberto Fuentes Gastelum), a millionaire businessman w… [+1728 chars]",1
16,"The adventures of a boy named Wally Trollman and his pet dragon, Norville.
Links: HOMEPAGE  iMDB
Wallykazam.S01.AMZN.WEB-DL.H264-LAZYMKV | AC3 | 25EP [5.8 GB]SubtitlesTorrent SearchUPLOADGiGNiTROFL… [+256 chars]",1
17,"<ul><li>Amazon (AMZN +1.9%
) plans to open at least 28 additional Amazon Fresh in the United States, according to Bloomberg research.</li><li>The first Fresh store opened in Los Angeles in September… [+839 chars]",1
18,"<ul><li>Amazon Web Services (NASDAQ:AMZN)&nbsp;announces new Amazon Elastic File System One Zone storage classes that reduce costs by 47% compared to the existing EFS storage classes, which use multi… [+939 chars]",1
19,"<ul><li>The local health authority has ordered Amazon (NASDAQ:AMZN) to close a fulfillment center in Brampton, Ontario, for two weeks due to rising COVID-19 cases.</li><li>Cases within the center hav… [+562 chars]",1
0,"image captionThe spill happened last May and saw some 21,000 tonnes of diesel pour into rivers
A mining firm has paid a record $2bn (£1.4bn) fine over a huge oil spill that caused one of Russia's wo… [+2683 chars]",1
1,"TORONTO, March 13, 2021 (GLOBE NEWSWIRE) -- In a release issued under the same headline on Friday, March 12th by Ayr Wellness Inc. (CSE:AYR.A, OTCQX:AYRWF), please note that in the last bullet of the… [+11606 chars]",1
2,"Fraser Health Public Health has declared a COVID-19 outbreak at Vitrum Glass, a glass manufacturer located at 9785 201st Street in Langley.
To date, 44 employees of the facility have tested positive… [+1556 chars]",1
3,"Fraser Health Public Health has declared a COVID-19 outbreak at Vitrum Glass, a glass manufacturer located at 9785 201st Street in Langley.
To date, 44 employees of the facility have tested positive… [+1556 chars]",1
4,"Fraser Health Public Health has declared a COVID-19 outbreak at Vitrum Glass, a glass manufacturer located at 9785 201st Street in Langley.
To date, 44 employees of the facility have tested positive… [+1556 chars]",1
5,"Fraser Health Public Health has declared a COVID-19 outbreak at Vitrum Glass, a glass manufacturer located at 9785 201st Street in Langley.
To date, 44 employees of the facility have tested positive… [+1556 chars]",1
6,"Fraser Health Public Health has declared a COVID-19 outbreak at Vitrum Glass, a glass manufacturer located at 9785 201st Street in Langley.
To date, 44 employees of the facility have tested positive… [+1556 chars]",1
7,"Apple has reached a deal to lease a new office in the South of Ireland, more specifically in Cork city. With over 36,000 square feet, the building will have enough space for another 350 to 400 additi… [+1387 chars]",1
8,"""I'm not doing this to get rich or stay rich for one quarter or two, I need to look at the long term,"" says Meyer. ""What I'm looking for is a sustainable supply, that doesn't run contrary to human co… [+1817 chars]",1
9,Studio Gang is known for being a super innovative company that produces some of the most unusual architectural designs and their latest concept is a mixed-use sustainable hotel called Populous! With … [+2511 chars],1
10,"The Garmin Venu and Garmin Venu Sq are two of the best Garmin watches available today, and if you're looking for a smart wearable that will double as a great fitness tracker, they're both excellent o… [+7866 chars]",1
11,The fishing panchayat of Kattupalli Kuppam in Tiruvallur district has written an open letter to all political parties asking them to give their opinions on a private port in the area asking for the s… [+1611 chars],1
12,"Since the onset of 2020s global pandemic, those of us tired of being cooped up indoors have kept ourselves busy by searching through rabbit holes of cabin designs to find one of our dreams. Prefabric… [+2271 chars]",-1
13,"Shares of Sprouts Farmers Market(NASDAQ:SFM), the grocery chain known for its fresh food and health and wellness products, has had a rough ride since the company went public in 2013. At the same time… [+3537 chars]",1
14,"Work is now complete on the Renzo Piano Building Workshop's much-anticipated Academy Museum of Motion Pictures in Los Angeles, California. The project involved renovating the iconic 1930s Saban Build… [+2673 chars]",1
15,"Minneapolis-based Fortune 500 retailer Target Corp. is ending its operations at the City Center complex in downtown Minneapolis. Boom.
The unexpected news is arguably comparable to a bomb going off … [+4600 chars]",-1
16,"Following news of its under-construction airport and Coral Bloom hotel, Foster + Partners has created yet another hotel to become part of the massive Red Sea Project desert development in Saudi Arabi… [+2334 chars]",1
17,"© Josh Partee
+ 33
<ul><li>
</li><li>Area
Area of this architecture project
Area: 101000 ft²</li><li>Year
Completion year of this architecture project 
Year: 
2020
 </li><li>Photographs
Pho… [+4853 chars]",1
18,"The Galápagos Islands hold an honored place in science history. I often wonder, if Charles Darwin could have seen this volcanic archipelago from this vantage point a satellite view how might have tha… [+2683 chars]",1
19,"In the latest trading session, Square (SQ) closed at $242.11, marking a +0.16% move from the previous day. This change outpaced the S&amp;P 500's 0.1% gain on the day. At the same time, the Dow added… [+2946 chars]",1
0,"This week's highlight game release is an update to an existing one, as Crash Bandicoot 4 gets upgraded for new-gen consoles and the PC. At the same time, Apex Legends makes its portable debut on the … [+5115 chars]",-1
1,"By Reuters Staff
FILE PHOTO: Guests wearing protective masks line up at AMC movie theatre in Lincoln Square, amid the coronavirus disease (COVID-19) pandemic, in the Manhattan borough of New York Ci… [+272 chars]",1
2,"By Reuters Staff
FILE PHOTO: Closed signs are seen on an AMC Theatre during the outbreak of the coronavirus disease (COVID-19), in New York City, U.S., April 29, 2020. REUTERS/Brendan McDermid
(Reu… [+1774 chars]",1
3,"By Reuters Staff
LOS ANGELES, March 12 (Reuters) - AMC Entertainment, the worlds largest cinema operator, will start reopening its Los Angeles locations starting with two theaters on Monday, the com… [+88 chars]",1
4,"Class Disrupted
Updated March 8, 2021
The latest on how the pandemic is reshaping education.
The Timess Matt Stevens and Sean Piccoli write:
Late last month, Gov. Andrew M. Cuomo cleared the way … [+1226 chars]",1
5,"AMC Entertainment posted a net loss of $4.59 billion for 2020 as the coronavirus pandemic forced most of its theaters to shutter for a large chunk of the past year.
The nation's largest movie theate… [+2291 chars]",-1
6,"By Reuters Staff
FILE PHOTO: A GameStop store is pictured in the Manhattan borough of New York City, New York, U.S., January 29, 2021. REUTERS/Carlo Allegri
(Reuters) - Shares of GameStop jumped be… [+1104 chars]",1
7,Express shares staged a double-digit run higher Wednesday after the apparel retailer and popular stock among retail investors on the Reddit social media platform included a target of $1 billion in on… [+1191 chars],1
8,"GameStop has been the centre of markets' attention this week
Spencer Platt/Getty
Shares of GameStop experienced a wild trading session on Wednesday reminiscent of the late January short-squeeze tha… [+1237 chars]",1
9,"The movie business may not be dead, but AMC Entertainment Holdings Inc.s stock is considerably overvalued, an analyst argued Wednesday. Richard Greenfield, an analyst with Lightshed Partners, initiat… [+3007 chars]",1
10,"By Reuters Staff
FILE PHOTO: Morning sunlight falls on the facade of the New York Stock Exchange (NYSE) building after the start of Thursday's trading session in Manhattan in New York City, New York… [+1985 chars]",1
11,(Reuters) - Futures tracking the S&amp;P 500 and the Nasdaq dipped on Wednesday as U.S. bond yields ticked higher ahead of key bond auctions while investors cautiously awaited a reading on inflation … [+2190 chars],-1
12,GameStop Corp. shares Wednesday were on track for their highest closing price in history and their longest winning streak since the videogame retailers stock became the poster child for Reddit-inspir… [+2616 chars],1
13,"AMC Entertainment Holdings Inc. reported a loss of nearly $1 billion in the holiday season to wrap up a woeful year of closed movie theaters, but executives sounded a hopeful note for reopening in 20… [+2513 chars]",1
14,"FILE PHOTO: Guests purchase tickets at the AMC movie theatre in Lincoln Square, amid the coronavirus disease (COVID-19) pandemic, in the Manhattan borough of New York City, New York, U.S., March 6, 2… [+2678 chars]",1
15,"(Reuters) - Futures tied to the Nasdaq 100 index jumped on Thursday as U.S. bond yields retreated to one-week lows on ebbing concerns over a strong pick up in inflation, while investors awaited data … [+2415 chars]",1
16,"Image source: The Motley Fool.
AMC Entertainment Holdings (NYSE:AMC)Q4 2020 Earnings CallMar 10, 2021, 5:00 p.m. ET
Contents:
<ul><li>Prepared Remarks</li><li>Questions and Answers</li><li>Call Pa… [+54380 chars]",-1
17,"(For a Reuters live blog on U.S., UK and European stock markets, click LIVE/ or type LIVE/ in a news window.)
* Weekly jobless claims fall in the latest week
* Oracle falls as revenue misses estima… [+3402 chars]",-1
18,"Hollywood has taken full advantage of this years stock market frenzy, seizing on the David vs. Goliath and retail trader vs. hedge fund storylines, which have already sparked about a dozen scripted a… [+5110 chars]",-1
19,"What happened
Theater operator AMC Entertainment(NYSE:AMC) has had a volatile couple of months. The business itself has been raising money to weather what the company hopes is the last leg toward re… [+1435 chars]",1
0,"After an extremely slow start, many analysts believe the next two years could see rapid growth in the battery-electric vehicle market. Credit the flood of new products coming to market. Many of those… [+8151 chars]",1
1,"Many high growth EV stocks are down YTD from last year's EV boom due to the global pandemic.
 Tesla (TSLA), the largest EV maker by market cap, saw big declines YTD as investors sold off TSLA stock … [+8352 chars]",1
2,The technology that we long believed would characterize the future has not just gotten billions in investment but there are many companies with multi-billion valuations to transform the world to futu… [+3960 chars],1
3,This is a bit of a tough note to write. I don't love this idea. I'm writing it up because I think it makes sense. I've put it on and it doesn't feel good. But maybe that's a good thing. Here's the de… [+6028 chars],-1
4,Starboard Value Acquisition Company (SVAC) is a SPAC that's merging with Miami-based data center play Cyxtera. It's led by Chief Executive Officer Nelson Fonseca and Executive Chairman Manuel Medina.… [+6601 chars],1
5,<ul> <li>The rally is electric vehicles stocks is intensifying today as a number of Wall Street firms came out with strong defenses along with some new initiations. Strong EV sales reported out of Ch… [+897 chars],1
6,Lucid Motors just released a video of CEO Peter Rawlinson taking the upcoming Air sedan for a test drive. It was the first time the Air appeared in public without camouflage. The test drive Air is a … [+4748 chars],1
7,"There's been a broad sell-off in SPAC names over the past two weeks, as the so-called blank-check boom deflates. 
For some 
 SPAC investors, it's a welcome change. 
Julian Klymochko, who runs the … [+4763 chars]",1
8,"Most weeks, the Commonwealth Bank of Australia (ASX: CBA) CommSec brokering platform tells us the ASX and international shares (usually just US shares) that are the most popular with its Australian c… [+3699 chars]",1
9,"The hottest investing trend on Wall Street over the past year faces a reckoning as shares of many high-profile special purpose acquisition companies have plunged over the past few weeks. 
Fast-risin… [+3500 chars]",1
10,"Electric-car startup Lucid Motors Inc. has an undisclosed commitment to build an assembly plant in Saudi Arabia, a potentially costly promise the company made after accepting more than $1 billion in … [+5726 chars]",1
0,"Lets talk volatility. The NASDAQ kicked off this week with a dip into correction territory, a fall to just over 10% below its February peak. And now? After three trading sessions, the index has bounc… [+8084 chars]",1
1,"Palantir Technologies Inc (NYSE: PLTR) and BlackBerry Ltd (NYSE: BB) have each snagged a slew of partnerships over the past year, disrupting the technology space and putting them in the spotlight as … [+3596 chars]",1
2,"Roblox, which is going public Wednesday via a direct listing, is due to give investors an indication of the price the shares might sell for later Tuesday.The videogaming platform will trade on the Ne… [+2614 chars]",1
3,POLAND - 2021/02/19: In this photo illustration a Reddit logo seen displayed on a smartphone with ... [+] stock market values in the background. (Photo Illustration by Omar Marques/SOPA Images/LightR… [+3714 chars],1
